{
  "schema_version": "0.1.0-draft",
  "document_example": true,
  "mode": "guarded_hybrid",
  "job_revision": 1,
  "source_geometry_sha256": "0000000000000000000000000000000000000000000000000000000000000000",
  "profile_id": "generic_conservative_unverified",
  "toolhead_profile_file": "profiles/generic_conservative_unverified.json",
  "selected_patch_ids": [],
  "policy": "strict_nonplanar",
  "export_status": "BLOCK",
  "notes": "Нулевой hash — placeholder примера. Это не валидированный 3MF/job."
}
